{
    "Type": "Overlord",
    "Name": "Worldbreaker",
    "Description": "Once per game: Destroy all Heroes in your dungeon. Gain [Cards] for each [Hero] destroyed this way.",
    "Mana": 1,
    "Cards": 2,
    "Food": 3,
    "Defence": 2,
    "Movement": 0,
    "Health": 0,
    "Creatures": [
        "Demon",
        "Demon",
        "Demon",
        "Magic",
        "Magic",
        "Wild",
        "Wild",
        "Undead",
        "Undead"
    ],
    "Background": "./backgrounds/Worldbreaker.png"
}
