{
    "Type": "Overlord",
    "Name": "Moonfang",
    "Description": "Put a counter face up on this Card, the counter is flipped at the start of each turn.<br>While the counter is face-down : [All] have +1 to [Defence],[Health] & [Movement]",
    "Mana": 2,
    "Cards": 2,
    "Defence": 0,
    "Health": 0,
    "Movement": 0,
    "Creatures": [
        "Demon",
        "Demon",
        "Magic",
        "Magic",
        "Wild",
        "Wild",
        "Wild",
        "All"
    ],
    "Background": "./backgrounds/Moonfang.png"
}
