{
    "Type":"Overlord",
    "Name":"Dragon God",
    "Description":"When [All] with Base [Defence] >= 4 would die, return it to your domain instead",
    "Mana":0,
    "Cards":1,
    "Defence":0,
    "Health":1,
    "Movement":0,
    "Creatures":["Demon","Magic","Magic","Wild","Wild","Wild","Wild","Wild"],
    "Background": "./backgrounds/Dragon_God.png"
}