{
    "Type": "Overlord",
    "Name": "Nameless Shadow",
    "Description": "[All] can move through walls",
    "Mana": 2,
    "Cards": 2,
    "Food": 1,
    "Defence": 0,
    "Movement": 0,
    "Health": 0,
    "Creatures": [
        "Demon",
        "Magic",
        "Magic",
        "Magic",
        "Undead",
        "Undead",
        "Undead",
        "All"
    ],
    "Background": "./backgrounds/Nameless_Shadow.png"
}
