{
    "Type": "Overlord",
    "Name": "Beelzebub",
    "Description": "[Cards] : Reroll the combat dice, activate this ability only once each turn.",
    "Mana": 2,
    "Cards": 2,
    "Food": 1,
    "Defence": 0,
    "Movement": 0,
    "Health": 0,
    "Creatures": [
        "Demon",
        "Demon",
        "Demon",
        "Demon",
        "Wild",
        "Wild",
        "All",
        "All"
    ],
    "Background": "./backgrounds/Beelzebub.png"
}
