{
    "Type": "Overlord",
    "Name": "Nightking",
    "Description": "",
    "Mana": 2,
    "Cards": 2,
    "Food": 0,
    "Defence": 1,
    "Movement": 1,
    "Health": 0,
    "Creatures": [
        "Demon",
        "Magic",
        "Magic",
        "Undead",
        "Undead",
        "Undead",
        "Undead",
        "Undead"
    ],
    "Background": "./backgrounds/Nightking.png"
}
