{
    "Type": "Overlord",
    "Name": "All Consuming Madness",
    "Description": "Whenever you draw [Chaos] gain 1 [Food]",
    "Mana": 3,
    "Cards": 2,
    "Defence": 0,
    "Health": 0,
    "Movement": 0,
    "Creatures": [
        "Demon",
        "Demon",
        "Magic",
        "Magic",
        "Wild",
        "Wild",
        "Undead",
        "Undead"
    ],
    "Background": "./backgrounds/All_Consuming_Madness.png"
}
